{
  "schema_version": "0.5.0",
  "case_ref": "CASE-0001",
  "assessment_id": "ASSESSMENT-0002",
  "origin_ref": "MODEL:origin-alpha:v1",
  "derivative_ref": "MODEL:student-beta:v1",
  "evidence_refs": [
    "EVIDENCE-0001",
    "EVIDENCE-0002",
    "EVIDENCE-0003",
    "EVIDENCE-0004",
    "EVIDENCE-0005"
  ],
  "fusion_refs": [
    "FUSION-0002"
  ],
  "assessment_state": "disputed",
  "confidence": 0.58,
  "assessment_basis": [
    "FUSION-0002 identified a materially conflicted evidentiary picture",
    "the independent reproduction did not reproduce the original watermark signal",
    "further review is required"
  ],
  "conflicting_evidence_refs": [
    "EVIDENCE-0005"
  ],
  "limitations": [
    "failed reproduction does not automatically invalidate EVIDENCE-0001",
    "complete training records remain unavailable"
  ],
  "assessment_policy_ref": "ASSESSMENT-POLICY:MEDA-v0.5-reference",
  "legal_effect": "human_review_required",
  "protocol_version": "0.5.0",
  "created_at": "2026-09-07T01:35:00Z"
}
